movie_ID,IMDB_ID,title,vote_average,vote_count,status,Release Date,Budget,Revenue,Popularity,Runtime,Language,Genres,Production Companies,Director,Top Cast,Keywords,Profit,Year,Distance From Mean
438457,tt4400994,The Ballad of Lefty Brown,6.2,179,Released,2017-12-15,8000000,7856,0.652,105,en,Western,"Higher Content, Om Films, Armian Pictures, Rival Pictures",Jared Moshé,"Bill Pullman, Peter Fonda, Kathy Baker","ambush, alcoholic, frontier justice, political expediency, a decent man, scapegoats",-7992144,2017,74873464.31326482
712454,tt7014378,The Summit of the Gods,7.771,365,Released,2021-09-22,9850000,1756552,1.4986,95,fr,"Animation, Adventure, Mystery","Julianne Films, Folivari, Melusine Productions",Patrick Imbert,"Éric Herson-Macarel, Damien Boisseau, Elisabeth Ventura","based on manga, mount everest, missing body, alpine climbing, investigative reporter",-8093448,2021,74974768.31326482
776503,tt10366460,CODA,7.925,2322,Released,2021-08-13,10000000,1905058,6.1422,112,en,"Drama, Music, Romance","Vendôme Pictures, Pathé, Picture Perfect Entertainment",Siân Heder,"Emilia Jones, Marlee Matlin, Troy Kotsur","parent child relationship, music teacher, fishing, deaf, massachusetts, coming of age, remake, singing, family, first love, disability, based on movie, woman director, sign languages, school choir, music school, calm, american sign language (asl), loving, teenager, appreciative",-8094942,2021,74976262.31326482
340101,tt1661275,Their Finest,6.7,416,Released,2017-02-19,11795877,3603484,0.9175,117,en,"Romance, War, Drama","BBC Film, HanWay Films, Number 9 Films, Filmgate Films, Ripken Productions, Pinewood Pictures, Wildgaze Films, Film i Väst, EuropaCorp",Lone Scherfig,"Gemma Arterton, Sam Claflin, Bill Nighy","based on novel or book, world war ii, filmmaking, war propaganda, woman director, london blitz, 1940s",-8192393,2017,75073713.31326482
555285,tt9185206,"Are You There God? It's Me, Margaret.",7.25,410,Released,2023-03-29,30000000,21800000,2.9646,107,en,"Comedy, Drama","Gracie Films, Lionsgate",Kelly Fremon Craig,"Abby Ryder Fortson, Rachel McAdams, Kathy Bates","puberty, adolescence, new jersey, based on novel or book, christianity, 1970s, female friendship, coming of age, religion, insecurity, woman director, speculative, mother daughter relationship, grandmother granddaughter relationship, jewish, stay-at-home mom",-8200000,2023,75081320.31326482
330947,tt2062700,Song to Song,5.478,874,Released,2017-03-17,10000000,1710528,1.4799,129,en,"Romance, Drama, Music","FilmNation Entertainment, Waypoint Entertainment",Terrence Malick,"Ryan Gosling, Michael Fassbender, Rooney Mara","love triangle, musician, record producer, sexual attraction, austin, texas, sexual experimentation, love story, philosophy of mind",-8289472,2017,75170792.31326482
399402,tt1846589,Hunter Killer,6.894,2214,Released,2018-10-19,40000000,31672678,5.6227,121,en,"Action, Adventure, Thriller","Original Film, G-BASE, Millennium Media, Hunter Killer Productions, SprocketHeads, Tucker Tooley Entertainment, Lionsgate, Davis Films, Summit Entertainment, Relativity Media",Donovan Marsh,"Gerard Butler, Gary Oldman, Toby Stephens","sniper, washington dc, usa, submarine, pentagon, u.s. navy, special forces, russian army, naval base, russian president, post cold war",-8327322,2018,75208642.31326482
567690,tt9357050,Dear Evan Hansen,6.3,332,Released,2021-09-24,27500000,19133454,2.3658,137,en,Drama,"Universal Pictures, Marc Platt Productions, Perfect World Pictures, dentsu",Stephen Chbosky,"Ben Platt, Amy Adams, Kaitlyn Dever","high school, suicide, letter, musical, based on play or musical, grief, teenage boy, guilt, mental illness, mental health, emotional vulnerability, social media, social anxiety, emotional abuse, mother son relationship, gay youth, 2010s, gaslighting, school bullying, absurd, admiring, awestruck, defiant, disapproving, disheartening, disrespectful, mocking, tragic",-8366546,2021,75247866.31326482
803114,tt11348232,The Requin,4.8,344,Released,2022-01-28,8500000,130493,2.6887,89,en,"Horror, Mystery, Thriller","Film Bridge International, Paper Street Pictures, Saban Films",Le Van Kiet,"Alicia Silverstone, James Tupper, Deirdre O'Connell","shark attack, shark, great white shark, storm at sea, survival at sea",-8369507,2022,75250827.31326482
529485,tt8544498,The Way Back,6.643,1226,Released,2020-03-05,23000000,14590514,1.6111,107,en,Drama,"Warner Bros. Pictures, Pearl Street Films, Mayhem Pictures, Bron Studios",Gavin O'Connor,"Ben Affleck, Al Madrigal, Michaela Watkins","change, alcoholism, widower, basketball team, basketball coach, addiction recovery, dramatic, admiring",-8409486,2020,75290806.31326482
615952,tt10343028,Armageddon Time,6.5,435,Released,2022-10-28,15000000,6524886,2.3628,114,en,Drama,"RT Features, Spacemaker Productions, Keep Your Head Productions, MadRiver Pictures, Focus Features",James Gray,"Banks Repeta, Anne Hathaway, Jeremy Strong","school friend, grandparent grandchild relationship, grandfather, arrest, ronald reagan, stealing, pta, semi autobiographical, 1980s, school board, jimmy carter",-8475114,2022,75356434.31326482
486131,tt4463894,Shaft,6.535,1746,Released,2019-06-14,30000000,21360215,3.841,111,en,"Action, Crime, Comedy, Mystery","Davis Entertainment, New Line Cinema",Tim Story,"Samuel L. Jackson, Jessie T. Usher, Regina Hall","sequel, shootout, drug lord, reboot, death of friend",-8639785,2019,75521105.31326482
734253,tt12915716,Adipurush,4.934,91,Released,2023-06-16,63000000,54300000,2.8029,179,hi,"History, Action, Adventure, Fantasy","Retrophiles, T-Series, AA Films, UV Creations, People Media Factory",Om Raut,"Prabhas, Saif Ali Khan, Kriti Sanon","ramayana, based on myths, legends or folklore, cgi-live action hybrid, bollywood",-8700000,2023,75581320.31326482
500916,tt7394816,Primal,5.6,384,Released,2019-12-27,9000000,146863,2.7565,97,en,"Action, Adventure, Thriller","Daniel Grodnik Productions, Wonderfilm Media, Imprint Entertainment, Artem Entertainment, Pimienta, Lionsgate",Nick Powell,"Nicolas Cage, Famke Janssen, Kevin Durand","assassin, affectation, amazon rainforest, cynical, freighter, aggressive, big game hunter, exotic animals, admiring, adoring, amused, appreciative, approving, assertive, commanding, complicated, earnest, sarcastic, sympathetic",-8853137,2019,75734457.31326482
373314,tt3658772,Misconduct,5.6,573,Released,2016-02-05,11000000,2049761,1.3553,106,en,"Drama, Thriller","Grindstone Entertainment Group, Lionsgate Premiere, Film Bridge International, Mike and Marty Productions",Shintaro Shimosawa,"Josh Duhamel, Anthony Hopkins, Al Pacino","kidnapping, ex-girlfriend, ambition, lawyer, psychological thriller, death, framed for murder, marital tensions, married man, clinical trials, civil suit, pharmaceuticals company, threats, pharmaceutical executive, playing with fire",-8950239,2016,75831559.31326482
413362,tt6000478,"Roman J. Israel, Esq.",6.346,1298,Released,2017-11-17,22000000,13025860,2.4633,122,en,"Drama, Crime, Thriller","Culture China - Image Nation Abu Dhabi Fund, Cross Creek Pictures, Bron Studios, Escape Artists, Image Nation Abu Dhabi, MACRO, Topic Studios, Columbia Pictures",Dan Gilroy,"Denzel Washington, Colin Farrell, Carmen Ejogo","briefcase, civil rights, murder, lawyer, los angeles, california, courtroom",-8974140,2017,75855460.31326482
440762,tt6521876,Jay and Silent Bob Reboot,5.676,553,Released,2019-10-15,10000000,1011305,1.5394,105,en,"Comedy, Action, Adventure","SModcast Pictures, View Askew Productions, Miramax, Saban Films, Destro Films, Hideout Pictures, Intercut Capital",Kevin Smith,"Jason Mewes, Kevin Smith, Harley Quinn Smith","comic book, hollywood, stoner, buddy comedy, aftercreditsstinger, duringcreditsstinger",-8988695,2019,75870015.31326482
293767,tt2513074,Billy Lynn's Long Halftime Walk,6.0,569,Released,2016-11-10,40000000,30930984,2.5095,113,en,"Drama, War","Bona Film Group, The Ink Factory, Marc Platt Productions, Studio 8, TriStar Pictures, Film4 Productions, LStar Capital, Haishang Films",Ang Lee,"Joe Alwyn, Kristen Stewart, Chris Tucker","post-traumatic stress disorder (ptsd), based on novel or book, war veteran, american football, thanksgiving, cheerleader, soldier, iraq war, producer, effects from the past",-9069016,2016,75950336.31326482
443791,tt5774060,Underwater,6.291,3188,Released,2020-01-08,50000000,40882928,4.5151,95,en,"Horror, Science Fiction, Action, Adventure","Chernin Entertainment, 20th Century Fox, TSG Entertainment",William Eubank,"Kristen Stewart, Vincent Cassel, Mamoudou Athie","monster, self sacrifice, deep sea, animal attack, giant monster, earthquake, survival, nuclear explosion, disaster, cryptozoology, female protagonist, underwater, survival horror, animal killing, creature feature, mechanical engineering, researcher, trapped underwater , 2050s",-9117072,2020,75998392.31326482
300667,tt4158624,3 Generations,6.4,433,Released,2016-10-27,10000000,680351,0.815,87,en,"Comedy, Drama","IM Global, Big Beach",Gaby Dellal,"Elle Fanning, Susan Sarandon, Naomi Watts","single mother, gender roles, lgbt, woman director, gender transition",-9319649,2016,76200969.31326482
591120,tt17491040,The Pirates: The Last Royal Treasure,6.529,204,Released,2022-01-26,19597380,10247262,3.2211,126,ko,"Action, Adventure, Comedy, Fantasy","Oscar 10 Studio, ANEW, Lotte Entertainment",Kim Joung-hoon,"Kang Ha-neul, Han Hyo-joo, Lee Kwang-soo","treasure, sequel, joseon dynasty (1392–1910)",-9350118,2022,76231438.31326482
157827,tt2217859,Louder Than Bombs,6.448,334,Released,2015-10-01,11000000,1400000,1.0944,105,en,Drama,"Motlys, Nimbus Film, Memento Films International, Memento Films Production, Animal Kingdom, Beachside Films, Bona Fide Productions, ARTE France Cinéma, Don't Look Now",Joachim Trier,"Gabriel Byrne, Isabelle Huppert, Jesse Eisenberg","new york city, sibling relationship, parent child relationship, loss of loved one, war photographer, grieving widower, grief, car accident, death of mother, father son reunion, existentialism, new york times, death of wife",-9600000,2015,76481320.31326482
429189,tt5825380,Wonder Wheel,6.389,1322,Released,2017-12-01,25000000,15366466,1.4085,101,en,"Drama, Romance","Gravier Productions, Amazon Studios, Perdido Productions",Woody Allen,"Jim Belushi, Juno Temple, Justin Timberlake","housewife, coney island, lifeguard, ferris wheel, 1950s, coney island, new york city",-9633534,2017,76514854.31326482
390051,tt4581576,Aftermath,5.7,911,Released,2017-02-28,10500000,840809,2.32,92,en,"Drama, Thriller","Ingenious Media, Protozoa Pictures, The Fyzz, Oak Productions, Pacific View Management, Union Editorial, Hat and Coat Productions, EFO Films",Elliott Lester,"Arnold Schwarzenegger, Scoot McNairy, Maggie Grace","depression, airplane, airport, forgiveness, sadness, investigation, mental breakdown, based on true story, flight, revenge, grief, tragedy, vigilante, lawyer, airplane crash, drinking, death, air traffic control, accusation",-9659191,2017,76540511.31326482
445954,tt6288694,Acts of Vengeance,5.9,572,Released,2017-10-27,10000000,320705,2.1279,87,en,"Thriller, Action, Drama",Nu Boyana Film Studios,Isaac Florentine,"Antonio Banderas, Karl Urban, Paz Vega","homeless person, fight, detective, child murder, talent show, revenge, murder, lawyer, drinking, underground fighting, murder investigation, homeless, death of wife",-9679295,2017,76560615.31326482
301355,tt1712192,Message from the King,6.254,456,Released,2017-05-10,10000000,315132,1.3929,102,en,"Action, Mystery, Thriller","The Ink Factory, Entre Chien et Loup, Rumble Films, Entertainment One Features, Silver Nitrate",Fabrice Du Welz,"Chadwick Boseman, Luke Evans, Alfred Molina","tattoo, morgue, flashback, money, los angeles, california, drugs, dentist, motel room, vengeance, south african",-9684868,2017,76566188.31326482
484468,tt7458762,The Wolf's Call,7.55,2042,Released,2019-02-20,22400000,12652790,2.6995,115,fr,"Thriller, Action, Adventure","Pathé, Trésor Films, Chi-Fou-Mi Productions, Jouror Productions",Antonin Baudry,"François Civil, Omar Sy, Mathieu Kassovitz","nuclear missile, chain of command, sonar, nuclear submarine, french army",-9747210,2019,76628530.31326482
426230,tt5816374,Band Aid,6.348,164,Released,2017-06-02,10000000,248370,0.647,91,en,"Comedy, Drama, Music","QC Entertainment, Mister Lister Films",Zoe Lister-Jones,"Zoe Lister-Jones, Adam Pally, Fred Armisen","relationship problems, neighbor, woman director",-9751630,2017,76632950.31326482
462115,tt5662550,Dead Trigger,3.7,46,Released,2017-07-19,10000000,151493,1.8158,92,en,"Action, Horror","Aldamisa Entertainment, Badhouse Studios Mexico, Distant Shore Films, Tadross Media Group, Voltage Pictures",Scott Windhauser,"Dolph Lundgren, Autumn Reeser, Romeo","based on video game, zombie apocalypse, virus",-9848507,2017,76729827.31326482
245846,tt2325977,Strangerland,5.3,265,Released,2015-07-01,10000000,111107,0.8889,111,en,"Drama, Thriller, Mystery","Screen Australia, Worldview Entertainment, Screen NSW, Fís Éireann/Screen Ireland, Wild Bunch, Dragonfly Pictures, Fastnet Films",Kim Farrant,"Nicole Kidman, Joseph Fiennes, Hugo Weaving","australia, missing child, outback, alcoholic drink, troubled marriage, woman director, australian outback, missing daughter",-9888893,2015,76770213.31326482
384737,tt4651410,Precious Cargo,5.1,288,Released,2016-07-15,10500000,567064,1.3115,99,en,"Action, Crime, Thriller","Mann Made Films, Lionsgate Premiere, Herrick Entertainment, Highland Film Group, EFO Films",Max Adams,"Bruce Willis, Mark-Paul Gosselaar, Claire Forlani","crime boss, heist",-9932936,2016,76814256.31326482
333386,tt2436682,The Duel,5.4,347,Released,2016-06-24,10000000,20672,0.8056,110,en,"Western, Drama","Media House Capital, 26 Films, Mandeville Films, Atomic Entertainment, Bron Capital Partners, Lionsgate Premiere, Mississippix Studios, Crystal Wealth",Kieran Darcy-Smith,"Woody Harrelson, Liam Hemsworth, Alice Braga","hunting human beings, murder",-9979328,2016,76860648.31326482
347629,tt2776878,Thank You for Your Service,6.547,384,Released,2017-10-26,20000000,9995692,1.4258,109,en,"Drama, War","DreamWorks Pictures, Amblin Entertainment, Dune Films",Jason Hall,"Miles Teller, Haley Bennett, Joe Cole","post-traumatic stress disorder (ptsd), based on novel or book, biography, soldier, military, war psychology",-10004308,2017,76885628.31326482
331313,tt2387499,Keeping Up with the Joneses,6.1,2044,Released,2016-10-20,40000000,29900000,2.0561,105,en,"Action, Comedy","Parkes+MacDonald Image Nation, Fox 2000 Pictures, TSG Entertainment",Greg Mottola,"Jon Hamm, Isla Fisher, Zach Galifianakis","spy, suburb, new neighbor, neighborhood",-10100000,2016,76981320.31326482
376166,tt3794028,From the Land of the Moon,6.6,305,Released,2016-10-19,10300000,47748,0.9477,120,fr,"Drama, Romance","Les Productions du Trésor, StudioCanal, Lunanime, France 3 Cinéma",Nicole Garcia,"Marion Cotillard, Louis Garrel, Àlex Brendemühl","based on novel or book, female protagonist, post world war ii, woman director",-10252252,2016,77133572.31326482
332794,tt1659619,The Odyssey,6.7,417,Released,2016-10-12,20000000,9722918,1.1297,122,fr,"Adventure, Drama","Moana Films, Pan Européenne Production, Fidélité Films, Curiosa Films",Jérôme Salle,"Lambert Wilson, Pierre Niney, Audrey Tautou","based on novel or book, biography, environmental activist, unfaithful husband, singing around campfire, frenchman abroad, singing on a boat",-10277082,2016,77158402.31326482
318781,tt4005402,Colonia,7.3,1909,Released,2015-06-24,14000000,3621046,2.4582,106,en,"Drama, History","Majestic Filmproduktion, Rat Pack Filmproduktion, Iris Productions, Fred Films",Florian Gallenberger,"Emma Watson, Daniel Brühl, Michael Nyqvist","kidnapping, 1970s, cult, chile, pinochet regime, religion, torture chamber, religious fundamentalism, military dictatorship, political unrest",-10378954,2015,77260274.31326482
290764,tt2401097,Tracers,6.0,1078,Released,2015-01-15,11000000,593683,2.0587,94,en,Action,"Cowtown Cinema Ventures, Temple Hill Entertainment",Daniel Benmayor,"Taylor Lautner, Marie Avgeropoulos, Adam Rayner","new york city, chinese mafia, parkour, loan shark, young adult",-10406317,2015,77287637.31326482
452832,tt6476140,Serenity,5.438,1546,Released,2019-01-24,25000000,14500000,3.1037,102,en,"Thriller, Mystery, Drama","Nebulastar, Shoebox Films",Steven Knight,"Matthew McConaughey, Anne Hathaway, Jason Clarke","video game, virtual reality, fisherman, domestic violence, co-workers relationship, alcohol abuse, older woman younger man relationship, fishing boat, neo-noir, isolated island, abusive stepfather, father son relationship, hunting obsession",-10500000,2019,77381320.31326482
341012,tt3960412,Popstar: Never Stop Never Stopping,6.618,1261,Released,2016-06-03,20000000,9500000,2.1312,86,en,"Comedy, Music","Universal Pictures, Apatow Productions, Party Over, The Lonely Island, Perfect World Pictures",Akiva Schaffer,"Andy Samberg, Jorma Taccone, Akiva Schaffer","concert, musician, pop star, celebrity, mockumentary, record album, cheerful",-10500000,2016,77381320.31326482
398924,tt5091612,A Bag of Marbles,7.818,862,Released,2017-01-18,21400000,10898998,1.6013,113,fr,"War, Drama","TF1 Films Production, Forecast Pictures, Main Journey, Gaumont, Quad Productions, IDL Films, Panache Productions, Proximus, Okko Production, La Compagnie Cinématographique",Christian Duguay,"Dorian Le Clech, Batyste Fleurial, Patrick Bruel","nazi officer, 1940s, occupied france (1940-44), brother brother relationship",-10501002,2017,77382322.31326482
614917,tt9620288,King Richard,7.636,2576,Released,2021-11-18,50000000,39400000,4.1283,144,en,"Drama, History","Star Thrower Entertainment, Westbrook, Warner Bros. Pictures, Overbrook Entertainment",Reinaldo Marcus Green,"Will Smith, Aunjanue Ellis-Taylor, Saniyya Sidney","sports, tennis, tennis player, father, based on true story, wimbledon, family, tennis pro, father daughter relationship, coaching, champions",-10600000,2021,77481320.31326482
407448,tt5390504,Detroit,7.272,1654,Released,2017-07-28,34000000,23400000,1.8211,143,en,"Crime, Drama, Thriller, History","Annapurna Pictures, Page 1, Harpers Ferry",Kathryn Bigelow,"John Boyega, Will Poulter, Anthony Mackie","fire, police brutality, church choir, based on true story, beating, murder, racism, church, detroit, michigan, 1960s",-10600000,2017,77481320.31326482
441130,tt5198068,Wolfwalkers,8.217,1236,Released,2020-10-26,12000000,1310720,4.0052,103,en,"Animation, Family, Adventure, Fantasy","Cartoon Saloon, Melusine Productions, Value&Power Culture Communications, Film Fund Luxembourg, Fís Éireann/Screen Ireland, Broadcasting Authority of Ireland, Haut et Court, Canal+, RTÉ, OCS, Pôle Image Magelis, Folivari, GKIDS",Tomm Moore,"Honor Kneafsey, Eva Whittaker, Sean Bean","friendship, wolf, magic, fairy tale, shapeshifting, wolf's lair, feral child, forest, woods, female protagonist, ireland, family, folklore, werewolf child, curious, calm, healer, reflective, wolves, irish folklore, hand drawn animation, father daughter relationship, mother daughter relationship, serene, fantasy, 1600s, enchanted forest, admiring, adoring, comforting, compassionate, enchant, excited, gentle",-10689280,2020,77570600.31326482
222936,tt1243974,Aloha,5.5,2060,Released,2015-05-29,37000000,26250020,2.7995,105,en,"Drama, Comedy, Romance","Vinyl Films, Scott Rudin Productions",Cameron Crowe,"Bradley Cooper, Emma Stone, Rachel McAdams","love triangle, hawaii, satellite, air force, military, duringcreditsstinger, communication",-10749980,2015,77631300.31326482
523366,tt7080422,Dragon Rider,7.112,156,Released,2020-10-13,17800000,7000000,1.4727,100,en,"Animation, Family, Adventure, Fantasy","Able & Baker, Constantin Film, Cyborn, Lumatic, RISE PICTURES",Tomer Eshed,"Thomas Brodie-Sangster, Freddie Highmore, Felicity Jones","himalaya mountain range, dragon, quest, anime",-10800000,2020,77681320.31326482
245703,tt2649554,Midnight Special,6.2,1913,Released,2016-02-18,18000000,7112282,1.8224,112,en,"Adventure, Drama, Science Fiction","Faliro House Productions, Tri-State Pictures, Warner Bros. Pictures, RatPac Entertainment, FilmNation Entertainment",Jeff Nichols,"Michael Shannon, Jaeden Martell, Joel Edgerton","helicopter, government, chase, parent child relationship, gas station, hostage, fbi, texas, motel, ranch, meteor, on the run, shootout, military, religious cult, child kidnapping, goggles",-10887718,2016,77769038.31326482
477489,tt5092380,Just a Breath Away,6.325,816,Released,2018-04-04,13749400,2842040,2.3963,90,fr,"Drama, Science Fiction, Thriller","Quad Productions, Section 9, Christal Films, Esprits Frappeurs, TF1 Films Production, TF1 Droits Audiovisuels, Atitlan, Mitico, Ten Films, Canal+, Ciné+, TF1, TMC, Téléfilm Canada, C8 Films",Daniel Roby,"Romain Duris, Olga Kurylenko, Fantine Harduin","paris, france, natural disaster, struggle for survival, mist, father daughter relationship",-10907360,2018,77788680.31326482
292011,tt3513548,Richard Jewell,7.43,2553,Released,2019-12-13,45000000,33900000,3.0673,131,en,Drama,"Warner Bros. Pictures, Malpaso Productions, Appian Way, Misher Films, 75 Year Plan Productions",Clint Eastwood,"Paul Walter Hauser, Jon Hamm, Kathy Bates","biography, standard police procedure, cautionary tale",-11100000,2019,77981320.31326482
234004,tt2865120,Ratchet & Clank,5.767,619,Released,2016-04-13,20000000,8800000,1.8395,94,en,"Action, Adventure, Animation, Family","Blockade Entertainment, CNHK Media China, Rainmaker Entertainment",Jericca Cleland,"James Arnold Taylor, David Kaye, Jim Ward","spacecraft, saving the world, extraterrestrial technology, villain, alien, best friend, robot, based on video game, aftercreditsstinger, duringcreditsstinger, woman director, spaceship mechanic",-11200000,2016,78081320.31326482
516632,tt5867314,The Empty Man,6.2,876,Released,2020-10-22,16000000,4796993,6.9077,137,en,"Horror, Mystery, Thriller","BOOM! Studios, Out of Africa Entertainment, 20th Century Fox",David Prior,"James Badge Dale, Marin Ireland, Sasha Frolova","experiment, detective, cave, missouri, investigation, bridge, cult, based on comic, ex-cop, hospital, based on graphic novel, alcoholic, bhutan, missing person, occult, cosmic horror, folk lore",-11203007,2020,78084327.31326482
157544,tt1524575,The Vatican Tapes,5.339,768,Released,2015-07-23,13000000,1784763,2.1515,91,en,"Thriller, Horror","Lionsgate, Lakeshore Entertainment, H2F Entertainment, Pantelion Films",Mark Neveldine,"Olivia Taylor Dudley, Michael Peña, Peter Andersson","exorcism, education, anti-christ, exorcist, wicked priest, young girls, government personal",-11215237,2015,78096557.31326482
354279,tt4086018,Charming,6.4,259,Released,2018-03-26,20000000,8751856,1.2264,90,en,"Animation, Adventure, Comedy, Family, Fantasy, Music","3QU Media, Storyoscopic Films, Vanguard Animation, WV Enterprises, Cinesite Animation",Ross Venokur,"Demi Lovato, Wilmer Valderrama, Sia","princess, fairy tale, prince",-11248144,2018,78129464.31326482
601337,tt7518786,83,7.152,56,Released,2021-12-23,36786988,25452983,1.4559,160,hi,"Drama, History","Kabir Khan Films, Vibri Media, Reliance Entertainment, Phantom Films, Nadiadwala Grandson Entertainment, KA Productions",Kabir Khan,"Ranveer Singh, Pankaj Tripathi, Tahir Raj Bhasin","sports, world cup, biography, cricket, based on true story, 1980s, bollywood",-11334005,2021,78215325.31326482
468224,tt3361792,Tolkien,6.948,1443,Released,2019-05-03,20000000,8654322,2.0529,112,en,"War, Drama, Romance","Fox Searchlight Pictures, TSG Entertainment, Chernin Entertainment",Dome Karukoski,"Nicholas Hoult, Lily Collins, Colm Meaney","world war i, male friendship, biography, based on true story, coming of age, mentor protégé relationship, boys' school, troubled relationship, oxford university, birmingham, boys club, edwardian england, 1900s",-11345678,2019,78226998.31326482
297806,tt1490785,I Saw the Light,6.3,206,Released,2016-02-05,13000000,1646788,0.9193,123,en,"Music, Drama","Bron Studios, RatPac Entertainment",Marc Abraham,"Tom Hiddleston, Elizabeth Olsen, Wayne Pére","country music, musical, biography, addiction, 1940s",-11353212,2016,78234532.31326482
310593,tt3312830,Youth,6.903,2082,Released,2015-05-20,13360000,2000000,2.3774,125,it,"Comedy, Drama, Romance","Indigo Film, Medusa Film, Barbary Films, Pathé, Number 9 Films, C-Films, France 2 Cinéma, Film4 Productions",Paolo Sorrentino,"Michael Caine, Harvey Keitel, Rachel Weisz","hotel, adultery, venice, italy, composer, switzerland, screenwriter, conductor, vacation, aging, swimming pool, director, old friends, alps mountains, opera singer, rock climbing, film director, adolf hitler, nude swimming, novalis",-11360000,2015,78241320.31326482
246127,tt1707380,Every Thing Will Be Fine,5.432,219,Released,2015-04-02,12000000,554953,0.6491,118,en,Drama,"Road Movies, Montauk Productions, Film i Väst, GötaFilm, Mer Film",Wim Wenders,"James Franco, Rachel McAdams, Charlotte Gainsbourg","canada, accidental death, loss of child",-11445047,2015,78326367.31326482
571783,tt9764654,Race to Freedom: Um Bok-dong,6.7,16,Released,2019-02-27,12547000,1091477,0.3857,116,ko,Drama,Celltrion Entertainment,Kim Yoo-sung,"Rain, Kang So-ra, Lee Beom-soo","resistance, bike, japanese occupation of korea",-11455523,2019,78336843.31326482
58431,tt1374989,Pride and Prejudice and Zombies,6.2,2192,Released,2016-02-04,28000000,16457494,3.2818,108,en,"Romance, Horror, Comedy, Thriller","Handsomecharlie Films, Cross Creek Pictures, Panorama Media, QC Entertainment, MadRiver Pictures, Allison Shearmur Productions, Head Gear Films, PPZ Holdings, Sierra/Affinity, Screen Gems",Burr Steers,"Lily James, Sam Riley, Jack Huston","based on novel or book, dystopia, shaolin, prejudice, zombie, pride, gold digger, 19th century, georgian or regency era, somber, parson, mashup, amused, antagonistic",-11542506,2016,78423826.31326482
