movie_ID,IMDB_ID,title,vote_average,vote_count,status,Release Date,Budget,Revenue,Popularity,Runtime,Language,Genres,Production Companies,Director,Top Cast,Keywords,Profit,Year,Distance From Mean
238713,tt3079380,Spy,6.829,6092,Released,2015-05-06,65000000,235666219,6.3609,120,en,"Action, Comedy, Crime","Chernin Entertainment, Feigco Entertainment, TSG Entertainment, 20th Century Fox",Paul Feig,"Melissa McCarthy, Rose Byrne, Jason Statham","central intelligence agency (cia), budapest, hungary, paris, france, undercover agent, rome, italy, spy, arms dealer, bulgaria, disaster, nuclear bomb, female spy, heiress, bumbling, aftercreditsstinger, duringcreditsstinger, analyst, ironic, suspicious, spycraft, beauty vs brains, handler, special assignment, mocking, modest, ridiculous",170666219,2015,103784898.68673518
629542,tt8115900,The Bad Guys,7.545,2138,Released,2022-03-17,80000000,250162278,9.8708,100,en,"Family, Comedy, Crime, Adventure, Animation",DreamWorks Animation,Pierre Perifel,"Sam Rockwell, Marc Maron, Awkwafina","based on novel or book, snake, wolf, affectation, spider, villain, heist, anthropomorphism, shark, guinea pig, piranha, duringcreditsstinger, zealous, wonder, understated, sentimental, amused, awestruck, cheerful, cliché, complicated, empathetic, enchant, enthusiastic, euphoric, modest",170162278,2022,103280957.68673518
536554,tt8760708,M3GAN,7.048,4193,Released,2022-12-28,12000000,181796517,18.6647,102,en,"Science Fiction, Horror","Atomic Monster, Blumhouse Productions, Divide / Conquer",Gerard Johnstone,"Allison Williams, Violet McGraw, Ronny Chieng","artificial intelligence (a.i.), killer robot, aunt niece relationship, evil doll, orphan, car accident, niece, robot, juvenile delinquent, doll, information leak, dead dog, nosy neighbor, hit by a car, dead parents, attacked by a dog, creepy doll, possessed doll, android horror",169796517,2022,102915196.68673518
423108,tt7069210,The Conjuring: The Devil Made Me Do It,7.411,6018,Released,2021-05-25,39000000,206431050,12.4499,111,en,"Horror, Mystery, Thriller","New Line Cinema, The Safran Company, Atomic Monster",Michael Chaves,"Patrick Wilson, Vera Farmiga, Ruairí O'Connor","supernatural, exorcism, connecticut, sequel, paranormal investigation, 1980s, somber, religious horror, the conjuring universe, frightened",167431050,2021,100549729.68673518
447200,tt5758778,Skyscraper,6.319,5065,Released,2018-07-11,125000000,292400000,3.5856,102,en,"Action, Thriller, Adventure","Flynn Picture Company, Legendary Pictures, Seven Bucks Productions, Universal Pictures, dentsu, Fuji Television Network",Rawson Marshall Thurber,"Dwayne Johnson, Neve Campbell, Chin Han","fire, china, skyscraper, hong kong, high tech, security system, pearl, penthouse, world's tallest building, trapped in burning building",167400000,2018,100518679.68673518
302699,tt1489889,Central Intelligence,6.416,6033,Released,2016-06-16,50000000,216972543,7.5206,107,en,"Action, Comedy","New Line Cinema, Bluegrass Films, RatPac Entertainment, Principato-Young Entertainment, Perfect World Pictures",Rawson Marshall Thurber,"Dwayne Johnson, Kevin Hart, Amy Ryan","central intelligence agency (cia), espionage, spy, secret agent, high school reunion, reconnect, accountant, radical transformation, high school classmates, glory days",166972543,2016,100091222.68673518
378236,tt4877122,The Emoji Movie,5.433,3142,Released,2017-07-23,50000000,216909830,4.8103,86,en,"Animation, Family, Comedy","Columbia Pictures, Sony Pictures Animation, LStar Capital",Tony Leondis,"T.J. Miller, James Corden, Anna Faris","villain, parody, 3d animation, emoji",166909830,2017,100028509.68673518
481084,tt1620981,The Addams Family,6.61,2365,Released,2019-10-10,40000000,204394183,5.6485,87,en,"Family, Animation, Comedy, Fantasy","Cinesite Animation, Nitrogen Studios Canada, Bron Studios, Metro-Goldwyn-Mayer, Creative Wealth Media Finance, The Jackal Group",Conrad Vernon,"Oscar Isaac, Charlize Theron, Chloë Grace Moretz","cartoon, black humor, family, addams family",164394183,2019,97512862.68673518
480530,tt6343314,Creed II,7.032,5492,Released,2018-11-21,50000000,214200000,9.1875,130,en,"Drama, Action","Metro-Goldwyn-Mayer, New Line Cinema, Chartoff-Winkler Productions",Steven Caple Jr.,"Michael B. Jordan, Sylvester Stallone, Tessa Thompson","sports, rivalry, sequel, los angeles, california, boxing, dedicated, box ring, ukraine",164200000,2018,97318679.68673518
376659,tt4651520,Bad Moms,6.502,4114,Released,2016-07-28,20000000,183936074,2.9796,100,en,Comedy,"STXfilms, BillBlock Media, Robert Simonds Productions, Suzanne Todd Productions, Huayi Brothers Pictures, Universal Pictures",Scott Moore,"Mila Kunis, Kristen Bell, Kathryn Hahn","infidelity, alcohol, mother role, hit-and-run, single mother, divorce, family, bathroom humor",163936074,2016,97054753.68673518
406563,tt5726086,Insidious: The Last Key,6.252,2951,Released,2018-01-03,10000000,172811971,6.0957,103,en,"Horror, Thriller","Stage 6 Films, Blumhouse Productions, Universal Pictures, Oren Peli Productions",Adam Robitel,"Lin Shaye, Leigh Whannell, Angus Sampson","key, medium, haunted house, prequel, spirit, 1950s, insidious",162811971,2018,95930650.68673518
577922,tt6723592,Tenet,7.181,10171,Released,2020-08-22,205000000,365304105,11.675,150,en,"Action, Thriller, Science Fiction","Warner Bros. Pictures, Syncopy",Christopher Nolan,"John David Washington, Robert Pattinson, Elizabeth Debicki","assassin, espionage, spy, time travel, mumbai (bombay), india, arms dealer, terrorism, terrorist attack, nuclear weapons, terrorist plot, backwards, alternate timeline, oslo, norway, time paradox, kyiv (kiev), ukraine",160304105,2020,93422784.68673518
257211,tt2361509,The Intern,7.22,6816,Released,2015-09-23,35000000,194564672,14.2997,121,en,Comedy,"Warner Bros. Pictures, RatPac Entertainment, Waverly Films",Nancy Meyers,"Robert De Niro, Anne Hathaway, Rene Russo","new york city, friendship, san francisco, california, office, masseuse, website, tai chi, internet, fish out of water, brooklyn, new york city, business start-up, driver, senior citizen, ceo, father figure, intern, social media, gentleman, woman director, city life, chivalry, retired life, professional woman, internship, e-comm, retailer, elderly widower, online store",159564672,2015,92683351.68673518
188927,tt2660888,Star Trek Beyond,6.782,6716,Released,2016-07-07,185000000,343471816,6.3072,122,en,"Action, Adventure, Science Fiction","Skydance Media, Paramount Pictures, Bad Robot, Perfect Storm Entertainment, Sneaky Shark",Justin Lin,"Chris Pine, Zachary Quinto, Karl Urban","spacecraft, sequel, stranded, hatred, lgbt, space opera, gay theme",158471816,2016,91590495.68673518
105864,tt1979388,The Good Dinosaur,6.732,5636,Released,2015-11-14,175000000,332207671,7.6683,93,en,"Adventure, Animation, Family","Pixar, Walt Disney Pictures",Peter Sohn,"Frances McDormand, Raymond Ochoa, Jeffrey Wright","friendship, tyrannosaurus rex, cartoon, villain, friends, alternate history, dinosaur, fear, storm, nature, journey",157207671,2015,90326350.68673518
257344,tt2120120,Pixels,5.741,7641,Released,2015-07-16,88000000,244900000,10.4787,106,en,"Action, Comedy, Science Fiction, Fantasy","Columbia Pictures, Happy Madison Productions, 1492 Pictures, LStar Capital, China Film Group Corporation, Film Croppers Entertainment, Prime Focus",Chris Columbus,"Adam Sandler, Kevin James, Michelle Monaghan","new york city, london, england, usa president, washington dc, usa, video game, nerd, alien, gamer, single mother, alien invasion, divorcee, centipede, childhood friends, military, gaming, divorced man, alien attack, 1980s, cable guy, live action and animation, donkey kong, darpa, taj mahal, india, guam, arcade game, world war, alternative world, old school, based on short, pattern, best friends, pixelation, video arcade, space invaders, galaga, pac-man",156900000,2015,90018679.68673518
329865,tt2543164,Arrival,7.612,18148,Released,2016-11-10,47000000,203388186,14.4945,116,en,"Drama, Science Fiction, Mystery","FilmNation Entertainment, Lava Bear Films, 21 Laps Entertainment",Denis Villeneuve,"Amy Adams, Jeremy Renner, Forest Whitaker","spacecraft, loss, time, alien, language, female protagonist, scientist, heartbreak, based on short story, military, alien language, linguist, first contact, communication, linguistics, time-manipulation, determinism, time manipulation",156388186,2016,89506865.68673518
529203,tt2850386,The Croods: A New Age,7.466,3900,Released,2020-11-25,65000000,215905815,13.1543,95,en,"Animation, Family, Adventure, Fantasy, Comedy","Universal Pictures, DreamWorks Animation",Joel Crawford,"Nicolas Cage, Emma Stone, Ryan Reynolds","sequel, prehistory, aftercreditsstinger, duringcreditsstinger, candid, playful, joyous, admiring, adoring",150905815,2020,84024494.68673518
718930,tt12593682,Bullet Train,7.44,6567,Released,2022-08-03,90000000,239300000,13.0859,126,en,"Action, Comedy, Thriller","87North Productions, Columbia Pictures",David Leitch,"Brad Pitt, Joey King, Aaron Taylor-Johnson","mission, japan, assassin, based on novel or book, train, luck, deadly snake, duringcreditsstinger, shinkansen",149300000,2022,82418679.68673518
300669,tt4160708,Don't Breathe,7.013,7547,Released,2016-06-08,9900000,158906350,5.8154,89,en,"Horror, Thriller","Screen Gems, Stage 6 Films, Ghost House Pictures",Fede Álvarez,"Stephen Lang, Jane Levy, Dylan Minnette","kidnapping, thief, blind, held captive, break in, blind man, trapped in a house",149006350,2016,82125029.68673518
800939,tt14109724,Ticket to Paradise,6.45,1275,Released,2022-09-08,20000000,168800000,3.814,104,en,"Drama, Comedy, Romance","Smoke House Pictures, Red Om Films, Working Title Films, Universal Pictures",Ol Parker,"Julia Roberts, George Clooney, Kaitlyn Dever","paradise, exotic island, architect, family relationships, indonesia, stranded, cultural difference, wedding, falling in love, american abroad, ex-husband ex-wife relationship, divorced parents, exotic locale, bali, drinking game, young lovers, airplane pilot, relationship sabotage, father daughter relationship, mother daughter relationship, memories, competitive, disapproving parent, balinese culture, daughter's wedding, college graduation, bali, indonesia, wedding customs, art gallery owner",148800000,2022,81918679.68673518
253412,tt2719848,Everest,6.821,4944,Released,2015-09-10,55000000,203427584,3.932,121,en,"Adventure, Drama, History","Cross Creek Pictures, Working Title Films, Walden Media, RVK Studios, Universal Pictures, Free State Pictures",Baltasar Kormákur,"Jason Clarke, Josh Brolin, Jake Gyllenhaal","himalaya mountain range, mountain, hiking, snowstorm, based on true story, climbing, snow, death, blizzard, mountain climbing, mount everest, grand, tense",148427584,2015,81546263.68673518
214756,tt2637276,Ted 2,6.311,7605,Released,2015-06-25,68000000,215863606,12.5045,115,en,"Comedy, Fantasy","Smart Entertainment, Universal Pictures, Fuzzy Door, Bluegrass Films, MRC",Seth MacFarlane,"Mark Wahlberg, Seth MacFarlane, Amanda Seyfried","sperm bank, sequel, buddy, courthouse, teddy bear, aftercreditsstinger, toy comes to life, provocative",147863606,2015,80982285.68673518
359940,tt5027774,"Three Billboards Outside Ebbing, Missouri",8.068,10282,Released,2017-12-01,15000000,162729321,5.3526,115,en,"Crime, Drama","Blueprint Pictures, Cutting Edge Group, Fox Searchlight Pictures, Film4 Productions",Martin McDonagh,"Frances McDormand, Woody Harrelson, Sam Rockwell","small town, suicide, police brutality, rape, missouri, dark comedy, alcoholism, murder, arson, cancer, teenage girl, police corruption, racism, anger, billboard, guilty conscience, molotov cocktail, pool hall",147729321,2017,80848000.68673518
227973,tt2452042,The Peanuts Movie,6.9,1676,Released,2015-11-05,99000000,246233113,4.3835,88,en,"Comedy, Animation, Family","Blue Sky Studios, 20th Century Fox Animation, 20th Century Fox, Feigco Entertainment",Steve Martino,"Noah Schnapp, Bill Melendez, Marleik 'Mar Mar' Walker","based on comic, red baron, family, comic strip, cartoon dog, aftercreditsstinger, duringcreditsstinger, the red baron",147233113,2015,80351792.68673518
522681,tt5886046,Escape Room,6.539,4748,Released,2019-01-03,9000000,155712077,6.0272,100,en,"Horror, Thriller, Mystery","Columbia Pictures, Original Film",Adam Robitel,"Taylor Russell, Logan Miller, Jay Ellis","chicago, illinois, key, riddle, code, puzzle, game, clue, magnet, box, cube, escape room, traumatized person, teamwork, mysterious box, sliding puzzle, pool table, death game",146712077,2019,79830756.68673518
390043,tt1959563,The Hitman's Bodyguard,6.891,6304,Released,2017-08-16,30000000,176586701,8.4768,118,en,"Action, Comedy, Crime, Thriller","Campbell Grobman Films, East Light Media, Nu Boyana Film Studios, Tom de Mol Productions, Summit Entertainment, Millennium Media, Davis Films, Cristal Pictures, Lionsgate, TIK Films",Patrick Hughes,"Ryan Reynolds, Samuel L. Jackson, Gary Oldman","assassin, court, england, hitman, bodyguard, travel, on the run, criminal, killer, courtroom, opposites attract, buddy comedy, aftercreditsstinger, testify",146586701,2017,79705380.68673518
267860,tt3300542,London Has Fallen,6.208,4795,Released,2016-03-02,60000000,205754447,6.6979,99,en,"Action, Thriller","Millennium Media, Gramercy Pictures, G-BASE, LHF Film, Nu Boyana Film Studios",Babak Najafi,"Gerard Butler, Aaron Eckhart, Angela Bassett","london, england, usa president, terrorism, political assassination, terrorist attack",145754447,2016,78873126.68673518
756999,tt7144666,The Black Phone,7.576,5078,Released,2022-06-17,16000000,161440742,8.8865,103,en,"Horror, Thriller","Blumhouse Productions, Crooked Highway",Scott Derrickson,"Mason Thames, Ethan Hawke, Madeleine McGraw","mask, small town, child abuse, dreams, sibling relationship, kidnapping, sadistic, 1970s, supernatural, cellar, colorado, bullying, basement, serial killer, based on short story, alcoholic father, child kidnapping, nervous",145440742,2022,78559421.68673518
207932,tt3062096,Inferno,6.077,6308,Released,2016-10-13,75000000,220021259,4.0589,121,en,"Mystery, Thriller, Action","Columbia Pictures, Imagine Entertainment",Ron Howard,"Tom Hanks, Felicity Jones, Omar Sy","amnesia, based on novel or book, italy, europe, sequel, murder, conspiracy, religion, church, virus, symbology",145021259,2016,78139938.68673518
345911,tt4786282,Lights Out,6.357,3913,Released,2016-07-21,4900000,149368835,3.2805,81,en,Horror,"New Line Cinema, Atomic Monster, Grey Matter Productions, RatPac Entertainment",David F. Sandberg,"Teresa Palmer, Maria Bello, Gabriel Bateman","suicide, sibling relationship, darkness, supernatural, paranormal phenomena, basement, parenthood, mental illness, fear of the dark, ghost, jump scare, based on short",144468835,2016,77587514.68673518
126889,tt2316204,Alien: Covenant,6.153,8845,Released,2017-05-09,97000000,240891763,10.9191,122,en,"Science Fiction, Horror, Thriller","20th Century Fox, Brandywine Productions, Scott Free Productions",Ridley Scott,"Michael Fassbender, Katherine Waterston, Billy Crudup","android, spacecraft, experiment, space travel, infection, engineer, alien life-form, sequel, alien, space, creature, robot, scientist, genocide, creation, acid, xenomorph, alien technology, genetic mutation",143891763,2017,77010442.68673518
479455,tt2283336,Men in Black: International,5.911,5011,Released,2019-06-12,110000000,253890701,5.7531,115,en,"Comedy, Science Fiction, Action","Amblin Entertainment, Parkes+MacDonald Image Nation, Columbia Pictures, Tencent Pictures",F. Gary Gray,"Chris Hemsworth, Tessa Thompson, Rebecca Ferguson","london, england, paris, france, secret organization, sahara desert, based on comic, sequel, co-workers relationship, alien invasion, brooklyn, new york city, eiffel tower, paris, buddy cop, alien friendship, weapons trafficking, marrakesh, morocco",143890701,2019,77009380.68673518
258509,tt2974918,Alvin and the Chipmunks: The Road Chip,6.014,1661,Released,2015-12-17,90000000,233755553,4.9797,92,en,"Family, Adventure, Comedy, Music, Animation","TSG Entertainment, Fox 2000 Pictures, Regency Enterprises, Bagdasarian Productions, Sunswept Entertainment",Walt Becker,"Jason Lee, Justin Long, Matthew Gray Gubler","anthropomorphism, chipmunk, hitchhiker, aftercreditsstinger, duringcreditsstinger, live action and animation",143755553,2015,76874232.68673518
351694,tt4644382,Monkey King: Hero Is Back,6.892,272,Released,2015-07-10,10000000,153000000,3.1683,89,zh,"Fantasy, Animation, Comedy","Hengdian Chinese Film Production Co., Beijing Weiying Shidai Technology (WePiao), October Media, October Animation Studio, S&C Pictures, Shandong Film & TV Group, BIGBIGSUN, MAX DREAM",Xiaopeng Tian,"Zhang Lei, Lin Zijie, Tong Zirong","based on novel or book, buddhism, xianxia, journey to the west, nezha, monkey king, son wukong",143000000,2015,76118679.68673518
348350,tt3778644,Solo: A Star Wars Story,6.557,8712,Released,2018-05-15,250000000,392952373,6.3131,135,en,"Science Fiction, Adventure, Action",Lucasfilm Ltd.,Ron Howard,"Alden Ehrenreich, Joonas Suotamo, Woody Harrelson","spacecraft, smuggling (contraband), prequel, spin off, space opera",142952373,2018,76071052.68673518
415214,tt6044910,Operation Mekong,6.966,253,Released,2016-09-30,30200000,173000000,1.7488,124,zh,"Action, Adventure, Crime, War",Film Fireworks Production,Dante Lam Chiu-Yin,"Zhang Hanyu, Eddie Peng Yu-Yan, Joyce Feng","china, boat, river, illegal drugs, incident, mekong",142800000,2016,75918679.68673518
353616,tt4765284,Pitch Perfect 3,6.523,3328,Released,2017-12-20,45000000,185400345,4.3928,93,en,"Comedy, Music","Gold Circle Films, Perfect World Pictures, Universal Pictures, Brownstone Productions",Trish Sie,"Anna Kendrick, Rebel Wilson, Brittany Snow","sequel, singer, acapella, uso, cliché",140400345,2017,73519024.68673518
268896,tt2557478,Pacific Rim: Uprising,6.131,5032,Released,2018-03-21,150000000,290061297,7.0661,111,en,"Action, Fantasy, Science Fiction, Adventure","Legendary Pictures, Double Dare You",Steven S. DeKnight,"John Boyega, Scott Eastwood, Cailee Spaeny","mind control, race against time, japan, army, monster, artificial intelligence (a.i.), saving the world, cadet, military officer, evacuation, giant monster, duty, military base, damage, dormitory, mad scientist, portal, rivalry, sequel, alien, coming of age, futuristic, mecha, giant robot, mind reading, creature, robot, scientist, criminal, one against many, combat, blizzard, female fighter, kaiju, wisecrack humor, transforming robot, alien monster, teenage hero, mental link, mass destruction, humanoid robot, robot suits, female warrior, aircraft, laser beam, mass evacuation, mount fuji, japan, computer hacker, tokyo, disapproving",140061297,2018,73179976.68673518
540901,tt5503686,Hustlers,6.475,2971,Released,2019-09-12,20000000,157563598,3.9328,110,en,"Drama, Comedy, Crime","STXfilms, Gloria Sanchez Productions, Nuyorican Productions",Lorene Scafaria,"Constance Wu, Jennifer Lopez, Julia Stiles","new york city, hustler, wall street, stripper, based on true story, strip club, biting, exotic dancer, stock market crash, economic crisis, reflective, based on magazine, newspaper or article, 2000s, inspired by magazine, newspaper or article, antagonistic",137563598,2019,70682277.68673518
570670,tt1051906,The Invisible Man,7.109,5825,Released,2020-02-26,7000000,144492724,7.5402,124,en,"Thriller, Science Fiction, Horror","Blumhouse Productions, Goalpost Pictures, Nervous Tick Productions, Universal Pictures",Leigh Whannell,"Elisabeth Moss, Aldis Hodge, Storm Reid","based on novel or book, pregnancy, architect, fake suicide, stalker, murder, domestic abuse, scientist, police detective, death, invisible person, mental hospital, angry, woman in peril, invisible man, frightened",137492724,2020,70611403.68673518
137116,tt2398241,Smurfs: The Lost Village,6.332,1464,Released,2017-03-23,60000000,197183546,4.255,89,en,"Animation, Family, Adventure, Comedy","Kerner Entertainment Company, Columbia Pictures, Sony Pictures Animation, LStar Capital, Wanda Pictures",Kelly Asbury,"Demi Lovato, Rainn Wilson, Joe Manganiello",reboot,137183546,2017,70302225.68673518
441889,tt6108090,Secret Superstar,7.267,172,Released,2017-10-19,286284,137416709,0.5794,150,hi,"Drama, Music","Zee Studios, Aamir Khan Productions",Advait Chandan,"Zaira Wasim, Aamir Khan, Meher Vij","husband wife relationship, violent husband, singing, abusive marriage, young singer, father daughter relationship, mother daughter relationship, bollywood",137130425,2017,70249104.68673518
348892,tt3863552,Bajrangi Bhaijaan,7.787,494,Released,2015-07-17,13000000,150000000,2.325,159,hi,"Comedy, Drama, Action","Rockline Entertainments, Kabir Khan Films, Salman Khan Films",Kabir Khan,"Salman Khan, Harshaali Malthotra, Nawazuddin Siddiqui","religion, journey, lost child, bollywood",137000000,2015,70118679.68673518
312221,tt3076658,Creed,7.405,7545,Released,2015-11-25,37000000,173600000,10.1069,133,en,"Action, Drama","Metro-Goldwyn-Mayer, New Line Cinema, Chartoff-Winkler Productions",Ryan Coogler,"Michael B. Jordan, Sylvester Stallone, Tessa Thompson","underdog, mexico, philadelphia, pennsylvania, sports, mentor, trainer, cancer, spin off, underground fighting, boxing trainer, motivational speaker, boxing, legacy, boxing manager, boxing champion, famous brand",136600000,2015,69718679.68673518
324786,tt2119532,Hacksaw Ridge,8.193,14026,Released,2016-10-07,40000000,175302354,20.926,139,en,"Drama, History, War","Summit Entertainment, Pandemonium, Cross Creek Pictures, Permut Presentations, Vendian Entertainment, Argent Pictures, IM Global, AI Film, Bliss Media, Kylin Pictures, Cosmos Filmed Entertainment, Icon Productions",Mel Gibson,"Andrew Garfield, Sam Worthington, Vince Vaughn","japan, hero, world war ii, abusive father, affectation, pacifism, bible, gore, vegetarian, biography, based on true story, okinawa, conscientious objector, religion, soldier, alcoholic, war hero, pacifist, medic, us military, battle of okinawa, congressional medal of honor, amused, combat medic, weaponless, seventh-day adventists",135302354,2016,68421033.68673518
446894,tt6182908,Smallfoot,6.792,1533,Released,2018-09-20,80000000,214115531,2.4252,96,en,"Family, Animation, Adventure, Fantasy, Comedy","Warner Animation Group, Zaftig Films, Warner Bros. Pictures",Karey Kirkpatrick,"Channing Tatum, James Corden, Zendaya","nepal, himalaya mountain range, musical, yeti, anthropomorphism, snow, creature, based on children's book, aftercreditsstinger, duringcreditsstinger, plane crash",134115531,2018,67234210.68673518
463272,tt6921996,Johnny English Strikes Again,6.266,2546,Released,2018-09-13,25000000,158972570,3.3153,89,en,"Action, Adventure, Comedy","Working Title Films, Working Title Films",David Kerr,"Rowan Atkinson, Olga Kurylenko, Ben Miller","spy, parody, sequel, slapstick comedy",133972570,2018,67091249.68673519
934433,tt17663992,Scream VI,6.998,2770,Released,2023-03-08,35000000,168961389,11.9593,123,en,"Horror, Crime, Thriller","Radio Silence Productions, Project X Entertainment, Spyglass Media Group, Paramount Pictures",Tyler Gillett,"Melissa Barrera, Jenna Ortega, Jasmin Savoy Brown","mask, new york city, trauma, halloween, college, fake identity, sequel, conspiracy theory, revenge, public murder, murder, social commentary, serial killer, police corruption, slasher, whodunit, multiple stabbings, brutality, killing spree, self-referential, crime spree, aftercreditsstinger, movie fan, copycat killer, satirical, generation z, fbi agent, irreverent, familiar, ridiculous",133961389,2023,67080068.68673519
713704,tt13345606,Evil Dead Rise,6.931,3228,Released,2023-04-12,15000000,147156372,11.1071,96,en,"Horror, Thriller","New Line Cinema, Pacific Renaissance Pictures, Renaissance Pictures, Ghost House Pictures, Wild Atlantic Pictures",Lee Cronin,"Lily Sullivan, Alyssa Sutherland, Morgan Davies","sibling relationship, pregnancy, earthquake, gore, sequel, los angeles, california, demon, evil, necronomicon, reboot, demonic possession, motherhood, aggressive, sisterhood, sister sister relationship, mischievous, body horror, apartment, furious, tense, intense, harsh",132156372,2023,65275051.68673519
324552,tt4425200,John Wick: Chapter 2,7.332,13340,Released,2017-02-08,40000000,171539887,15.422,122,en,"Action, Thriller, Crime","Thunder Road, 87Eleven, Summit Entertainment",Chad Stahelski,"Keanu Reeves, Common, Ian McShane","martial arts, assassin, hitman, italy, roof, secret organization, sequel, revenge, shootout, handshake, neo-noir, guns, dark, dogs, roof-top",131539887,2017,64658566.68673519
495764,tt7713068,Birds of Prey (and the Fantabulous Emancipation of One Harley Quinn),6.902,10381,Released,2020-02-05,75000000,205537933,6.6642,109,en,"Action, Crime","Warner Bros. Pictures, DC Films, LuckyChap Entertainment, Clubhouse Pictures, Kroll & Co Entertainment",Cathy Yan,"Margot Robbie, Rosie Perez, Mary Elizabeth Winstead","police, pickpocket, chase, joker, psychopath, superhero, nightclub, gang leader, based on comic, breaking the fourth wall, betrayal, vigilante, mobster, organized crime, shootout, female protagonist, orphan, criminal, police officer, police detective, spin off, hyena, held at gunpoint, henchman, exploding body, death of family, crime family, female police officer, nightclub owner, crime lord, woman director, hand to hand combat, vigilantism, suspended cop, murder of family, dc extended universe (dceu), dumped by boyfriend, loss of family, supernatural power, female antihero, vigilantes, betrayal of trust, vigilante justice, jailbreak, suspended from job, grand, hilarious, amused, audacious",130537933,2020,63656612.68673519
