movie_ID,IMDB_ID,title,vote_average,vote_count,status,Release Date,Budget,Revenue,Popularity,Runtime,Language,Genres,Production Companies,Director,Top Cast,Keywords,Profit,Year,Distance From Mean
785084,tt13833688,The Whale,7.827,4110,Released,2022-12-09,3000000,55101305,7.0929,117,en,Drama,"A24, Protozoa Pictures",Darren Aronofsky,"Brendan Fraser, Sadie Sink, Ty Simpkins","depression, nurse, missionary, idaho, bible, overweight man, based on play or musical, dying man, obesity, religion, death of lover, rebellious daughter, recluse, lgbt, eating disorder, empathy, teen anger, english teacher, abandonment, alcoholic mother, father daughter relationship, homosexual father, essay, religious symbolism, father daughter estrangement, morbidly obese, binge eating, queer loneliness",52101305,2022,14780015.31326481
619730,tt10731256,Don't Worry Darling,6.799,2607,Released,2022-09-21,35000000,86700000,4.9692,123,en,"Mystery, Horror, Thriller","Vertigo Entertainment, New Line Cinema",Olivia Wilde,"Florence Pugh, Harry Styles, Chris Pine","suburbian idyll, cult, palm springs, psychological thriller, stepford wife, woman director, 1950s, cultists, unhappy wife",51700000,2022,15181320.31326481
417678,tt5001718,"Everything, Everything",7.2,3694,Released,2017-05-18,10000000,61621140,3.1302,96,en,"Drama, Romance","Alloy Entertainment, Itaca Films, Metro-Goldwyn-Mayer, Warner Bros. Pictures",Stella Meghie,"Amandla Stenberg, Nick Robinson, Anika Noni Rose","based on novel or book, nurse, isolation, love, neighbor, teenage girl, air, teenage love, illness, sheltered, taking a risk, based on young adult novel",51621140,2017,15260180.31326481
567609,tt7798634,Ready or Not,7.0,4733,Released,2019-08-21,6000000,57600000,7.5762,95,en,"Horror, Comedy","Mythology Entertainment, Vinson Films, Fox Searchlight Pictures, Radio Silence Productions",Matt Bettinelli-Olpin,"Samara Weaving, Adam Brody, Mark O'Brien","escape, ritual, marriage, satanism, gore, pact with the devil, wealth, murder, wedding, game, exploding body, wedding dress, satanic cult, death game, absurd, frightened, horrified",51600000,2019,15281320.31326481
585268,tt7430722,War,6.75,332,Released,2019-10-02,16000000,67450000,2.6378,152,hi,"Action, Thriller, Adventure","Yash Raj Films, Reverie Entertainment",Siddharth Anand,"Hrithik Roshan, Tiger Shroff, Ashutosh Rana","friendship, chase, gun, italy, portugal, spy, traitor, two man army, karate, love, betrayal, shootout, one man army, explosion, india, motorcycle, one against many, mentor protégé relationship, motorcycle chase, new delhi india, yrf spy universe, bollywood",51450000,2019,15431320.31326481
390497,tt5910280,Tunnel,7.292,593,Released,2016-08-10,1000000,52444295,1.5988,126,ko,"Thriller, Drama","BA Entertainment, Showbox",Kim Seong-hun,"Ha Jung-woo, Bae Doona, Oh Dal-su","survival, disaster, reporter, trapped, rescue team, news reporter, trapped underground, south korea",51444295,2016,15437025.31326481
298618,tt0439572,The Flash,6.657,4483,Released,2023-06-13,220000000,271333313,15.0657,144,en,"Adventure, Action, Science Fiction","Warner Bros. Pictures, Double Dream, The Disco Factory, DC Films",Andy Muschietti,"Ezra Miller, Sasha Calle, Michael Keaton","hero, secret identity, superhero, based on comic, superhuman, super power, aftercreditsstinger, butterfly effect, dc extended universe (dceu), superhuman abilities, loss of mother",51333313,2023,15548007.31326481
416477,tt5462602,The Big Sick,7.33,2469,Released,2017-03-30,5000000,56303596,4.4469,120,en,"Comedy, Drama, Romance","FilmNation Entertainment, Apatow Productions, Story Ink",Michael Showalter,"Kumail Nanjiani, Zoe Kazan, Holly Hunter","chicago, illinois, new york city, immigrant, muslim, roommates, sadness, sarcasm, comedian, based on true story, one-man show, pakistan, family relationships, film in film, matchmaking, cultural difference, hospital, falling in love, family, illness, group of friends, intercultural relationship, aftercreditsstinger, college student, uber, traditional family, comedy club, stand-up comedian, grad school",51303596,2017,15577724.31326481
401981,tt2873282,Red Sparrow,6.533,6065,Released,2018-02-28,69000000,151572634,5.8217,140,en,"Thriller, Mystery","Chernin Entertainment, 20th Century Fox, TSG Entertainment",Francis Lawrence,"Jennifer Lawrence, Joel Edgerton, Matthias Schoenaerts","central intelligence agency (cia), sexual abuse, budapest, hungary, based on novel or book, self sacrifice, spy, patriotism, seduction, training, double agent, chechnya, hospital, torture, mole, female spy, mortal danger, deceit, uncle niece relationship, american embassy, moscow, russia, russian spy, hopeless, spy thriller, bolshoi ballet, ballet performance, secret code, prima ballerina, mother daughter relationship, theatre, asset, home health aide, secret meeting, gorky park",82572634,2018,15691313.68673519
291870,tt1860213,Dirty Grandpa,5.925,4411,Released,2016-01-20,11500000,94100000,4.9635,102,en,Comedy,"Covert Media, Lionsgate, BillBlock Media, QED International, Josephson Entertainment, Ninjas Runnin' Wild Productions, Taurus Film",Dan Mazer,"Robert De Niro, Zac Efron, Aubrey Plaza","funeral, golf, grandfather, road trip, crude humor, retired, pervert, army general, spring break, law firm, fiancé fiancée relationship, sex comedy, mini cooper, engaged couple, death of wife, imminent wedding, malicious, moving, grandfather grandson relationship, corporate lawyer, death of grandmother, boca raton, florida, amused, ridiculous",82600000,2016,15718679.68673519
167073,tt2381111,Brooklyn,7.312,3114,Released,2015-10-20,11000000,62076141,3.6745,111,en,"Romance, Drama, History","Wildgaze Films, Parallel Film Productions, BBC Film, Bun and Ham Productions, Finola Dwyer Productions, Item 7, Ingenious Media",John Crowley,"Saoirse Ronan, Domhnall Gleeson, Emory Cohen","ship, based on novel or book, love triangle, homesickness, marriage, community, working class, boarding house, suburb, ireland, brooklyn, new york city, journey, irish immigrant, 1950s",51076141,2015,15805179.31326481
585216,tt9844522,Escape Room: Tournament of Champions,6.532,2080,Released,2021-07-01,15000000,65774490,5.0523,88,en,"Horror, Thriller, Mystery","Original Film, Columbia Pictures, Shaken, Not Stirred Productions",Adam Robitel,"Taylor Russell, Logan Miller, Indya Moore","sequel, no escape, escape room, death game",50774490,2021,16106830.31326481
432527,tt5935704,Padmaavat,6.943,279,Released,2018-01-25,31000000,81673897,3.7527,163,hi,"Drama, History, Romance","Bhansali Productions, Viacom18 Studios",Sanjay Leela Bhansali,"Deepika Padukone, Ranveer Singh, Shahid Kapoor","epic, husband wife relationship, obsession, queen, delhi, india, afghanistan, sultan, musical, romance, honor, king, battle, period drama, fortress, based on song, poem or rhyme, medieval, mongol, history of india, 13th century, ancient india, mewar, india, bollywood",50673897,2018,16207423.31326481
304357,tt2404425,Woman in Gold,7.3,1392,Released,2015-03-20,11000000,61619773,1.5791,109,en,Drama,"Origin Pictures, BBC Film",Simon Curtis,"Helen Mirren, Ryan Reynolds, Tatiana Maslany","nazi, based on true story, art, stolen painting",50619773,2015,16261547.31326481
374111,tt4253360,The Himalayas,6.6,28,Released,2015-12-16,0,50544493,0.6895,125,ko,"Adventure, Drama","JK Film, CJ Entertainment",Lee Suk-hoon,"Hwang Jung-min, Jung Woo, Cho Seong-ha","rescue mission, climbing, snow, mountaineering, mountain rescue",50544493,2015,16336827.31326481
449443,tt1259528,Den of Thieves,6.84,3053,Released,2018-01-18,30000000,80509622,20.2851,140,en,"Action, Crime, Thriller","Atmosphere Entertainment MM, Diamond Film Productions, G-BASE, Tucker Tooley Entertainment, STXfilms, Universal Pictures",Christian Gudegast,"Gerard Butler, Pablo Schreiber, O'Shea Jackson Jr.","police brutality, detective, fbi, assault rifle, deputy sheriff, investigation, strip club, donut, heist, shootout, los angeles, california, divorce, bank robbery, hostage situation, death, ex-marine, security, armored truck, ex military, donut shop, bar",50509622,2018,16371698.31326481
337170,tt3532216,American Made,6.886,4603,Released,2017-08-18,50000000,133511855,8.9612,115,en,"Comedy, Crime, Drama","Universal Pictures, Cross Creek Pictures, Imagine Entertainment, Vendian Entertainment, Quadrant Pictures, Hercules Film Fund",Doug Liman,"Tom Cruise, Domhnall Gleeson, Sarah Wright","central intelligence agency (cia), drug smuggling, money laundering, pilot, based on true story, drug cartel, illegal drugs, dea agent, 1980s, pablo escobar",83511855,2017,16630534.68673519
573699,tt9288776,White Snake,7.711,493,Released,2019-01-11,11936735,62098770,3.9512,99,zh,"Romance, Animation, Fantasy","Light Chaser Animation Studios, Beijing Joy Pictures, Tianjin Maoyan Weying Media, Zhejiang Hengdian Film Production, Beijing Jinyi Jiayi Film Distribution, Dadi Film",Amp Wong,"Zhang Zhe, Yang Tianxiang, Tang Xiaoxi","assassin, china, emperor, love, dragon, poverty, ancient, 3d animation, donghua, cartoon snake",50162035,2019,16719285.31326481
290595,tt2381991,The Huntsman: Winter's War,6.286,4851,Released,2016-04-06,115000000,164989338,5.6521,114,en,"Action, Adventure, Drama","Roth Films, Universal Pictures, Perfect World Pictures",Cedric Nicolas-Troyan,"Chris Hemsworth, Charlize Theron, Emily Blunt","witch, strong woman, magic, fairy tale, female soldier, female empowerment, huntsman, wicked woman, live action remake",49989338,2016,16891982.31326481
487297,tt7634968,What Men Want,6.2,1475,Released,2019-02-08,20000000,69766483,5.1561,117,en,"Comedy, Romance","BET Films, Paramount Players, Paramount Pictures, Will Packer Productions",Adam Shankman,"Taraji P. Henson, Aldis Hodge, Josh Brener","telepathy, bartender, partnership, psychic, widower, single father, boxing trainer, national basketball association (nba), personal assistant, basketball player, sports agent, retelling, boys club, atlanta, georgia, father daughter relationship, best friends, woman in a man's world, best friend's wedding, passed over for promotion",49766483,2019,17114837.31326481
323676,tt2702724,The Boss,5.824,1346,Released,2016-04-07,29000000,78600000,1.8584,91,en,Comedy,"Universal Pictures, On the Day, Gary Sanchez Productions",Ben Falcone,"Melissa McCarthy, Kristen Bell, Peter Dinklage","business woman, ex-con, duringcreditsstinger, girl scouts",49600000,2016,17281320.31326481
646389,tt5884796,Plane,6.933,2346,Released,2023-01-12,25000000,74515586,7.0144,107,en,"Action, Adventure, Thriller","MadRiver Pictures, di Bonaventura Pictures, G-BASE, Olive Hill Media, Riverstone Pictures",Jean-François Richet,"Gerard Butler, Mike Colter, Tony Goldwyn","airplane, pilot, philippines, held hostage, plane crash, intense",49515586,2023,17365734.31326481
192141,tt1781922,No Escape,6.938,2569,Released,2015-08-26,5000000,54400000,3.7087,103,en,"Thriller, Action","Living Films, Bold Films, Brothers Dowdle Productions",John Erick Dowdle,"Owen Wilson, Lake Bell, Pierce Brosnan","hotel, rebellion, race against time, revolution, coup d'etat, engineer, survival, execution, american, family, american abroad, u.s. embassy",49400000,2015,17481320.31326481
616820,tt10665342,Halloween Ends,6.064,1832,Released,2022-10-12,20000000,104374176,6.3562,111,en,"Horror, Thriller","Universal Pictures, Blumhouse Productions, Miramax, Rough House Pictures, Trancas International Films",David Gordon Green,"Jamie Lee Curtis, Andi Matichak, James Jude Courtney","mask, sadism, radio station, psychopath, homicide, insanity, trauma, halloween, forbidden love, babysitter, illinois, bullying, sequel, halloween party, rampage, serial killer, slasher, accidental death, multiple stabbings, motorcycle, stabbing, sewer, evil, death of son, reboot, homeless man, mentor protégé relationship, autumn, halloween costume, grieving father, memoir, murder spree, human monster, death of a child, doomed romance, sadistic killer, grandmother granddaughter relationship, masked killer, junkyard, holiday horror",84374176,2022,17492855.68673519
449176,tt5164432,"Love, Simon",7.996,6081,Released,2018-02-16,17000000,66316289,4.0183,110,en,"Comedy, Drama, Romance","Temple Hill Entertainment, Fox 2000 Pictures, New Leaf Literary & Media, 20th Century Fox, Twisted Media",Greg Berlanti,"Nick Robinson, Logan Miller, Alexandra Shipp","coming out, sexual identity, high school, based on novel or book, sexuality, class, coming of age, bully, love, teen movie, male homosexuality, lgbt, lgbt teen, based on young adult novel, gay theme, boys' love (bl)",49316289,2018,17565031.31326481
306819,tt0810819,The Danish Girl,7.57,5785,Released,2015-11-27,15000000,64200000,4.8862,119,en,Drama,"Pretty Pictures, Working Title Films, Artémis Productions, Shelter Productions, Senator Global Productions, ReVision Pictures, Working Title Films",Tom Hooper,"Eddie Redmayne, Alicia Vikander, Matthias Schoenaerts","paris, france, based on novel or book, denmark, copenhagen, denmark, artist, painter, historical fiction, art, transsexual, surgery, lgbt, mourning, 1920s, desperate, dramatic, cliché, derogatory",49200000,2015,17681320.31326481
456570,tt5764096,Hindi Medium,7.271,175,Released,2017-05-19,3213790,52390000,0.909,132,hi,"Comedy, Drama",Maddock Films,Saket Chaudhary,"Irrfan Khan, Saba Qamar, Sanjana Sanghi","education system, bollywood",49176210,2017,17705110.31326481
323675,tt2869728,Ride Along 2,6.248,1700,Released,2016-01-14,40000000,124827316,3.0786,102,en,"Action, Comedy","Reel Chefs Catering, Universal Pictures, Will Packer Productions, Cube Vision",Tim Story,"Kevin Hart, Ice Cube, Olivia Munn","police, family relationships, sequel, police officer, misadventure, buddy film",84827316,2016,17945995.68673519
339964,tt2239822,Valerian and the City of a Thousand Planets,6.625,7588,Released,2017-07-20,177200000,225973340,9.095,137,en,"Adventure, Science Fiction, Action","Belga Films, River Road Entertainment, Grive Productions, EuropaCorp, UFA, Fundamental Films, Gulf Film, Novo Pictures, TF1 Films Production, Orange Studio, BNP Paribas Fortis",Luc Besson,"Dane DeHaan, Cara Delevingne, Clive Owen","future, shapeshifting, space travel, utopia, based on comic, alien, alien planet, energy, alien abduction, genocide, parallel world, political intrigue , pacifist, space opera, military, government agent, marketplace, trapped in space, federal government, unity, cosmopolis",48773340,2017,18107980.31326481
399360,tt4244998,Alpha,6.531,2583,Released,2018-08-17,51000000,99630675,6.8651,97,en,"Adventure, Drama","Studio 8, Columbia Pictures",Albert Hughes,"Kodi Smit-McPhee, Jóhannes Haukur Jóhannesson, Marcin Kowalczyk","wolf, ice age, human animal relationship, wilderness, survival, prehistory, snow, saber-toothed tiger, boy and dog, injury, pets, bison, upper palaeolithic, boar, appreciative, empathetic",48630675,2018,18250645.31326481
43074,tt1289401,Ghostbusters,5.3,6494,Released,2016-07-14,144000000,229147509,5.2558,117,en,"Action, Fantasy, Comedy","Ghost Corps, Columbia Pictures, Village Roadshow Pictures, LStar Capital, Feigco Entertainment, Pascal Pictures, The Montecito Picture Company",Paul Feig,"Kristen Wiig, Melissa McCarthy, Kate McKinnon","female friendship, ghost hunting, reboot, ghost",85147509,2016,18266188.68673519
309302,tt2909116,Wolf Totem,6.5,381,Released,2015-02-19,38000000,123205624,0.9221,116,zh,"Adventure, Drama","China Film Group Corporation, Columbia Pictures, Reperage, China Movie Channel, China Film Co-Production Corp., Loull Productions, Wild Bunch, Mars Films, Chinavision Media Group, Mandrill Visual Effects",Jean-Jacques Annaud,"William Feng, Shawn Dou, Ankhnyam Ragchaa","wolf, animals, epic battle, historical drama, 1960s",85205624,2015,18324303.68673519
241251,tt3181822,The Boy Next Door,4.9,2044,Released,2015-01-23,4000000,52425855,2.9738,91,en,Thriller,"Smart Entertainment, Blumhouse Productions, Nuyorican Productions",Rob Cohen,"Jennifer Lopez, Ryan Guzman, Ian Nelson","infidelity, high school, parent child relationship, loss of loved one, obsession, insanity, blackmail, villain, blind date, stalker, hidden camera, sociopath, unrequited love, neighbor, fatal attraction, older woman younger man relationship, aggressive, erotic thriller",48425855,2015,18455465.31326481
304372,tt3862750,The Perfect Guy,5.7,328,Released,2015-09-11,12000000,60273173,1.9194,100,en,"Drama, Thriller","Screen Gems, Rocklin / Faust",David M. Rosenthal,"Sanaa Lathan, Michael Ealy, Morris Chestnut","detective, stalking, los angeles, california, falling in love, break-up, group of friends, boyfriend girlfriend relationship, chance meeting, volatile, restraining order, lobbyist, long term relationship, perfect man, new relationship, mr. right, suspense thriller, want to get married, dangerous",48273173,2015,18608147.31326481
527641,tt6472976,Five Feet Apart,8.238,5698,Released,2019-03-14,7000000,92600000,9.3621,116,en,"Romance, Drama","Wayfarer Entertainment, CBS Films",Justin Baldoni,"Haley Lu Richardson, Cole Sprouse, Moisés Arias","forbidden love, terminal illness, hospital, best friend, falling in love, cystic fibrosis, star crossed lovers, first date, true love, teenager, dramatic, sentimental, romantic, melodramatic",85600000,2019,18718679.68673519
278924,tt3522806,Mechanic: Resurrection,6.019,3416,Released,2016-08-25,40000000,125729635,7.191,98,en,"Action, Crime, Thriller","Davis Films, ME2 Productions, Millennium Media, Chartoff-Winkler Productions, Summit Entertainment",Dennis Gansel,"Jason Statham, Jessica Alba, Tommy Lee Jones","assassin, sequel, murder, mechanic, killer, around the world",85729635,2016,18848314.68673519
166424,tt1502712,Fantastic Four,4.423,6060,Released,2015-08-05,120000000,167977596,5.1976,100,en,"Action, Adventure, Science Fiction","20th Century Fox, Constantin Film, Marvel Entertainment, Marv, Genre Films, Robert Kulzer Productions, TSG Entertainment",Josh Trank,"Miles Teller, Michael B. Jordan, Kate Mara","teleportation, superhero, transformation, telekinesis, portal, based on comic, superhero team, invisible person",47977596,2015,18903724.31326481
463319,tt6864046,Shadow,6.726,399,Released,2018-09-30,44005000,91708374,1.901,116,zh,"Action, War","Village Roadshow Pictures Asia, LeVision Pictures, Bona Film Group, Perfect Village Entertainment, Tencent Pictures",Zhang Yimou,"Deng Chao, Sun Li, Ryan Zheng","shadow, sombra, ying",47703374,2018,19177946.31326481
287948,tt2938956,The Transporter Refueled,5.506,1504,Released,2015-09-02,25000000,72629670,3.8967,95,en,"Action, Thriller, Crime","EuropaCorp, TF1 Films Production, Fundamental Films, Canal+, OCS, TF1, TMC, Belga Films, Belga Productions",Camille Delamarre,"Ed Skrein, Ray Stevenson, Loan Chabanol","transporter, sequel, french riviera, reboot, bank heist",47629670,2015,19251650.31326481
434119,tt5606538,Confidential Assignment,6.8,132,Released,2017-01-18,8520000,56100000,1.9197,125,ko,"Action, Drama","CJ Entertainment, JK Film, Rear Window, HB Entertainment",Kim Sung-hoon,"Hyun Bin, Yoo Hai-jin, Kim Joo-hyuk","police, spy, detective, buddy cop, cooperation, buddy detective duo, inter-korean relations, seoul, south korea",47580000,2017,19301320.31326481
505026,tt7657566,Death on the Nile,6.43,3807,Released,2022-02-09,90000000,137307235,7.1052,127,en,"Mystery, Crime, Thriller","The Mark Gordon Company, Genre Films, 20th Century Studios, Scott Free Productions",Kenneth Branagh,"Kenneth Branagh, Tom Bateman, Annette Bening","egypt, based on novel or book, detective, honeymoon, nile, remake, mysterious, murder mystery, 1930s, frustrated",47307235,2022,19574085.31326481
724495,tt8093700,The Woman King,7.672,2151,Released,2022-09-16,50000000,97300000,6.333,135,en,"Action, Drama, History","TriStar Pictures, JuVee Productions, Entertainment One, Welle Entertainment, TSG Entertainment II",Gina Prince-Bythewood,"Viola Davis, Thuso Mbedu, Lashana Lynch","africa, arranged marriage, warrior woman, based on true story, slave trade, duringcreditsstinger, woman director, military unit, aggressive, 19th century, mother daughter reunion, freed slave, female warrior, west africa, weapons training, factual, reminiscent, admiring, celebratory, commanding, exhilarated",47300000,2022,19581320.31326481
587807,tt1361336,Tom & Jerry,6.77,2468,Released,2021-02-10,50000000,136536687,5.1096,101,en,"Comedy, Family, Animation","Warner Animation Group, Turner Entertainment, The Story Company, Warner Bros. Pictures",Tim Story,"Chloë Grace Moretz, Michael Peña, Colin Jost","aftercreditsstinger, live action and animation",86536687,2021,19655366.68673519
455980,tt2854926,Tag,6.706,3209,Released,2018-05-30,28000000,75100000,6.6928,100,en,"Comedy, Action","New Line Cinema, Broken Road Productions, Warner Bros. Pictures",Jeff Tomsic,"Ed Helms, Jon Hamm, Jeremy Renner","based on true story, travel, game, group of friends, classmates",47100000,2018,19781320.31326481
479718,tt7468056,The Outlaws,7.673,453,Released,2017-10-03,5900000,52946454,5.3267,121,ko,"Action, Crime, Thriller","Hong Film, BA Entertainment",Kang Yun-sung,"Don Lee, Yoon Kye-sang, Jo Jae-yun","police, detective, gang, illegal alien, 2000s, korean chinese, seoul, south korea",47046454,2017,19834866.31326481
261023,tt1355683,Black Mass,6.517,3399,Released,2015-09-17,53000000,99975678,3.7641,123,en,"Drama, Crime, History","Vendian Entertainment, Infinitum Nihil, Head Gear Films, Cross Creek Pictures, Free State Pictures, RatPac Entertainment, Le Grisbi Productions",Scott Cooper,"Johnny Depp, Joel Edgerton, Julianne Nicholson","prostitute, corruption, boston, massachusetts, gangster, fbi, senator, based on true story, irish mob, beaten to death, pay phone, murder, organized crime, extortion, brutality, informant, illness, 1980s",46975678,2015,19905642.31326481
249070,tt2679042,Hitman: Agent 47,5.876,3101,Released,2015-08-20,35000000,81967450,6.8704,96,en,"Action, Crime, Thriller","Daybreak Productions, Prime Universe Productions, Giant Pictures, TSG Entertainment, Dayday Films, Ingenious Media, Fox International Productions",Aleksander Bach,"Rupert Friend, Zachary Quinto, Hannah Ware","assassin, hitman, secret identity, intelligence, execution, killer, based on video game",46967450,2015,19913870.31326481
287903,tt3850590,Krampus,6.198,2244,Released,2015-11-26,15000000,61800000,3.7828,98,en,"Horror, Comedy, Fantasy","Universal Pictures, Legendary Pictures, Zam Pictures",Michael Dougherty,"Emjay Anthony, Adam Scott, Toni Collette","winter, holiday, santa claus, snowstorm, flashback, fireplace, snow, creature, power outage, destruction, demon, blizzard, based on myths, legends or folklore, christmas, bad kids, holiday horror",46800000,2015,20081320.31326481
502416,tt7958736,Ma,5.817,2280,Released,2019-05-29,5000000,51749995,4.8931,99,en,"Horror, Thriller","Blumhouse Productions, Wyolah Films, dentsu, Fuji Television Network",Tate Taylor,"Octavia Spencer, Juliette Lewis, Diana Silvers","casino, kidnapping, psychopath, underage drinking, revenge, murder, slasher, psychological thriller, stabbing, veterinary, mental illness, loner, school loner, hanging out, munchausen syndrome by proxy",46749995,2019,20131325.31326481
577328,tt8983202,Kabir Singh,6.4,139,Released,2019-06-20,8751000,55478164,1.824,172,hi,"Drama, Romance","Cine1 Studios, T-Series",Sandeep Reddy Vanga,"Shahid Kapoor, Kiara Advani, Arjan Bajwa","self-destruction, delhi, india, surgeon, family relationships, love, remake, based on movie, medical student, anger issues, unconditional love, self hatred, bollywood",46727164,2019,20154156.31326481
268531,tt2091256,Captain Underpants: The First Epic Movie,6.2,1237,Released,2017-06-01,38000000,125427681,3.2667,88,en,"Family, Comedy, Adventure, Animation","DreamWorks Animation, Scholastic Entertainment",David Soren,"Kevin Hart, Thomas Middleditch, Ed Helms","friendship, based on novel or book, superhero, underwear, villain, comic book, school, principal, based on children's book, grade school, sock puppet",87427681,2017,20546360.68673519
1008042,tt10638522,Talk to Me,7.159,3167,Released,2023-07-26,4500000,92000000,18.3933,95,en,Horror,"Causeway Films, Screen Australia, South Australian Film Corporation, Bankside Films, Head Gear Films, Metrol Technology",Danny Philippou,"Sophie Wilde, Alexandra Jensen, Joe Bird","suicide, trauma, possession, female friendship, addiction, grief, female protagonist, death of mother, self mutilation, mental health, dead parent, social media, peer pressure, disembodied hand, generation z, self-harm, supernatural horror, cautionary tale, adelaide australia, body horror, teenager, modern australia",87500000,2023,20618679.68673519
440472,tt1987680,The Upside,7.143,1304,Released,2019-01-10,37500000,125000000,4.3661,126,en,"Comedy, Drama",Escape Artists,Neil Burger,"Kevin Hart, Bryan Cranston, Nicole Kidman","based on true story, remake, class differences, caregiver, man in wheelchair, interracial friendship, social differences, rich man, quadriplegia, male nurse, handicapped, disabled person, feel good",87500000,2019,20618679.68673519
346672,tt3717252,Underworld: Blood Wars,5.896,3731,Released,2016-11-24,35000000,81093313,7.1629,91,en,"Fantasy, Action, Thriller","Lakeshore Entertainment, Screen Gems, Sketch Films",Anna Foerster,"Kate Beckinsale, Theo James, Tobias Menzies","martial arts, sword, vampire, hybrid, ambition, sequel, betrayal, conspiracy, werewolf, gothic, uzi, dark fantasy, woman director, urban gothic, assertive, ominous",46093313,2016,20788007.31326481
640146,tt10954600,Ant-Man and the Wasp: Quantumania,6.293,5220,Released,2023-02-15,388369742,476071180,9.7229,125,en,"Action, Adventure, Science Fiction","Marvel Studios, Kevin Feige Productions",Peyton Reed,"Paul Rudd, Evangeline Lilly, Michael Douglas","hero, superhero, ant, based on comic, sequel, alternate dimension, family, aftercreditsstinger, duringcreditsstinger, marvel cinematic universe (mcu)",87701438,2023,20820117.68673519
